{
  "diagnostic_dimensions": {
    "access_regimes": [
      "open",
      "api"
    ],
    "content_modalities": [
      "tabular",
      "multidimensional",
      "time_series",
      "document"
    ],
    "disciplines": [
      "multidisciplinary"
    ],
    "languages": [
      "en"
    ],
    "lifecycle_modes": [
      "mutable",
      "revised_release",
      "archived",
      "deprecated"
    ],
    "metadata_maturity": "machine_readable",
    "origin_types": [
      "hybrid"
    ],
    "production_modes": [
      "official_statistics",
      "census",
      "survey",
      "administrative",
      "modelled_estimates"
    ],
    "provenance_roles": [
      "derivative_aggregator",
      "official_harmonizer"
    ],
    "scale_classes": [
      "large"
    ],
    "sensitivity_classes": [
      "public"
    ],
    "structural_archetypes": [
      "hierarchical_catalog",
      "flat_table_collection",
      "statistical_cube",
      "file_archive"
    ],
    "versioning_models": [
      "revision_chain",
      "dated_snapshot",
      "none"
    ]
  },
  "evidence": [
    {
      "evidence_type": "official_catalog",
      "retrieved_at": "2026-08-21T03:32:45Z",
      "supports": [
        "identity",
        "36_datamart_denominator",
        "provider_roles",
        "update_state",
        "alternative_routes"
      ],
      "title": "UNdata Sources catalog and update calendar",
      "url": "https://data.un.org/DataMartInfo.aspx"
    },
    {
      "evidence_type": "api_documentation",
      "retrieved_at": "2026-08-21T03:32:45Z",
      "supports": [
        "sdmx_route",
        "format_support",
        "partial_datamart_coverage"
      ],
      "title": "UNdata API Manual",
      "url": "https://data.un.org/Host.aspx?Content=API"
    },
    {
      "evidence_type": "live_metadata_probe",
      "retrieved_at": "2026-08-21T03:32:45Z",
      "supports": [
        "interactive_datamart_inventory",
        "table_and_hierarchy_route"
      ],
      "title": "UNdata Explorer ordered datamart manifest",
      "url": "https://data.un.org/Handlers/ExplorerHandler.ashx?t=marts"
    },
    {
      "evidence_type": "live_metadata_probe",
      "retrieved_at": "2026-08-21T03:32:45Z",
      "supports": [
        "sdmx_dataflow_inventory",
        "sdmx_unit_route_selection"
      ],
      "title": "UNdata SDMX dataflow manifest",
      "url": "https://data.un.org/ws/rest/dataflow/all/all/latest"
    },
    {
      "evidence_type": "license",
      "retrieved_at": "2026-08-21T03:32:45Z",
      "supports": [
        "public_access",
        "attribution",
        "provider_responsibility"
      ],
      "title": "UNdata Conditions of Use",
      "url": "https://data.un.org/Host.aspx?Content=UNdataUse"
    }
  ],
  "fallback_policy": {
    "access_failure": "Continue public metadata mapping, record a typed blocker, and never infer observation availability.",
    "change": "Fingerprint the bounded universe and reopen affected checks and stages when upstream structure or version changes.",
    "scale": "Partition by a stable native order or manifest; preserve counts, range boundaries, and checksums.",
    "semantic_ambiguity": "Retain source-native elements, defer Variable or Construct promotion, and request human review when consequential.",
    "unknown_structure": "Use open_world_custom; preserve observed facts; propose a reusable route only after evidence and tests."
  },
  "generated_at": "2026-08-21T03:35:16.570513+00:00",
  "goal": {
    "completion_claim": "exhaustive_snapshot",
    "research_question": null,
    "scope_mode": "exhaustive_snapshot"
  },
  "human_gates": [],
  "plan_status": "ready",
  "required_facets": [
    {
      "completion_evidence": "Official identity and institutional evidence with canonical GRDR references.",
      "id": "core.source_identity",
      "requirement": "Resolve canonical source identity, aliases, responsible institutions, and database boundary.",
      "scope": "project",
      "source_routes": [
        "core_metadata"
      ],
      "stage": "project"
    },
    {
      "completion_evidence": "Evidence-backed provenance chain with unresolved roles explicitly recorded.",
      "id": "core.provenance_roles",
      "requirement": "Separate original production, collection, harmonization, derivation, publication, mirroring, and maintenance roles.",
      "scope": "project",
      "source_routes": [
        "core_metadata"
      ],
      "stage": "project"
    },
    {
      "completion_evidence": "Boundary statement, enumeration rule, dated evidence, and known denominator or explicit non-enumerable limitation.",
      "id": "core.boundary_denominator",
      "requirement": "Define a reproducible dated, versioned, partitioned, question-bounded, or rolling universe and denominator strategy.",
      "scope": "project",
      "source_routes": [
        "core_metadata"
      ],
      "stage": "project"
    },
    {
      "completion_evidence": "Official version/change documentation or repeated probes with a refresh policy.",
      "id": "core.change_model",
      "requirement": "Identify snapshot, release, revision, append, rolling, deletion, and schema-change behavior.",
      "scope": "project",
      "source_routes": [
        "core_metadata"
      ],
      "stage": "project"
    },
    {
      "completion_evidence": "Current authoritative policy evidence and any required human authorization gate.",
      "id": "core.governance_rights",
      "requirement": "Record licenses, terms, citation, attribution, privacy, ethics, sovereignty, retention, and redistribution controls.",
      "scope": "project",
      "source_routes": [
        "core_metadata"
      ],
      "stage": "project"
    },
    {
      "completion_evidence": "Official dataset metadata, method documentation, and canonical Dataset record.",
      "id": "core.dataset_methodology",
      "requirement": "Resolve unit identity, producer, population or universe, observation unit, method, coverage, release, limitations, and citation.",
      "scope": "unit",
      "source_routes": [
        "core_metadata"
      ],
      "stage": "dataset"
    },
    {
      "completion_evidence": "Quality or methodology evidence and explicit unknown/not-applicable decisions.",
      "id": "core.quality_uncertainty",
      "requirement": "Record missingness, suppression, imputation, uncertainty, calibration, revisions, bias, and comparability limits where applicable.",
      "scope": "unit",
      "source_routes": [
        "core_metadata"
      ],
      "stage": "dataset"
    },
    {
      "completion_evidence": "Versioned schema, codebook, manifest, instrument, graph, array, stream, or observed structure.",
      "id": "core.native_structure",
      "requirement": "Recover the source-native organization without substituting an access URL for structure.",
      "scope": "unit",
      "source_routes": [
        "core_metadata"
      ],
      "stage": "data_structure"
    },
    {
      "completion_evidence": "Reproducible count, ordering or manifest, and canonical DataElement coverage.",
      "id": "core.element_universe",
      "requirement": "Enumerate native fields, dimensions, measures, identifiers, attributes, flags, items, coordinates, or annotations within the declared boundary.",
      "scope": "unit",
      "source_routes": [
        "core_metadata"
      ],
      "stage": "data_element"
    },
    {
      "completion_evidence": "Official definitions plus structural selections, units, population, resolution, and comparability.",
      "id": "core.operational_semantics",
      "requirement": "Define research-matchable operational quantities without inferring them from topic labels.",
      "scope": "unit",
      "source_routes": [
        "core_metadata"
      ],
      "stage": "variable"
    },
    {
      "completion_evidence": "Evidence-backed mappings with directness and scope limitations.",
      "id": "core.construct_semantics",
      "requirement": "Link variables to constructs while distinguishing direct, subjective, administrative, constructed, modelled, forecast, proxy, and latent measures.",
      "scope": "unit",
      "source_routes": [
        "core_metadata"
      ],
      "stage": "construct"
    },
    {
      "completion_evidence": "Key definitions and a tested or explicitly limited joinability assessment.",
      "id": "core.identifiers_joinability",
      "requirement": "Document entity identifiers, time keys, spatial keys, version keys, linkage assumptions, collision risks, and identity resolution.",
      "scope": "unit",
      "source_routes": [
        "core_metadata"
      ],
      "stage": "variable"
    },
    {
      "completion_evidence": "Dated access probes or evidenced controlled-access procedure covering every required route.",
      "id": "core.access_reproducibility",
      "requirement": "Test metadata and observation access separately and record authentication, limits, formats, environment, query, and reproducibility conditions.",
      "scope": "unit",
      "source_routes": [
        "core_metadata"
      ],
      "stage": "access"
    },
    {
      "completion_evidence": "Machine-recomputed SHA-256 fingerprints for the plan, scope, and unit manifest match the persisted execution locks.",
      "id": "core.execution_lock",
      "requirement": "Lock the audited plan, declared scope, and ordered work-unit manifest so an Agent cannot silently change the target, denominator, routes, or completion claim.",
      "scope": "project",
      "source_routes": [
        "core_metadata"
      ],
      "stage": "project"
    },
    {
      "completion_evidence": "Replay tests and current project history reproduce the same next target and validate every checkpoint checksum.",
      "id": "core.resume_integrity",
      "requirement": "Persist deterministic checkpoints and resume the first unfinished target without skipping, substitution, or loss after process, network, or session interruption.",